{
  "schema_version": "1.0.0",
  "run_id": "cloudflare-email-evidence-20260728",
  "provider": "cloudflare-email",
  "adapter_version": "0.3.12",
  "capability_document_sha256": "62d0cb01554048e96af0bb07b75d58660a341b65e8c421c0bb62e5d98c8c4bfb",
  "started_at": "2026-07-27T14:00:00.000Z",
  "completed_at": "2026-07-28T10:25:12.000Z",
  "evidence_url": "https://github.com/haya-inc/hayasend/issues/104",
  "case_count": 21,
  "summary": {
    "passed": 18,
    "failed": 0,
    "unsupported": 3
  },
  "status": "passed",
  "results": [
    {
      "case_id": "api-plain-text-fallback",
      "status": "passed",
      "evidence_url": "https://github.com/haya-inc/hayasend/issues/103"
    },
    {
      "case_id": "api-atomic-commit",
      "status": "passed",
      "evidence_url": "https://github.com/haya-inc/hayasend/issues/103"
    },
    {
      "case_id": "outbox-queue-unavailable",
      "status": "passed",
      "evidence_url": "https://github.com/haya-inc/hayasend/issues/103"
    },
    {
      "case_id": "outbox-ack-crash",
      "status": "passed",
      "evidence_url": "https://github.com/haya-inc/hayasend/issues/103"
    },
    {
      "case_id": "scheduler-wakeup-loss",
      "status": "passed",
      "evidence_url": "https://github.com/haya-inc/hayasend/issues/132"
    },
    {
      "case_id": "long-delay-recovery",
      "status": "passed",
      "evidence_url": "https://github.com/haya-inc/hayasend/issues/132"
    },
    {
      "case_id": "send-lease-concurrency",
      "status": "passed",
      "evidence_url": "https://github.com/haya-inc/hayasend/issues/103"
    },
    {
      "case_id": "provider-permanent-rejection",
      "status": "passed",
      "evidence_url": "https://github.com/haya-inc/hayasend/issues/103"
    },
    {
      "case_id": "provider-throttle",
      "status": "passed",
      "evidence_url": "https://github.com/haya-inc/hayasend/issues/103"
    },
    {
      "case_id": "provider-acceptance-ambiguity",
      "status": "passed",
      "evidence_url": "https://github.com/haya-inc/hayasend/issues/103"
    },
    {
      "case_id": "provider-event-ordering",
      "status": "passed",
      "evidence_url": "https://github.com/haya-inc/hayasend/issues/103"
    },
    {
      "case_id": "recipient-mixed-outcomes",
      "status": "passed",
      "evidence_url": "https://github.com/haya-inc/hayasend/issues/103"
    },
    {
      "case_id": "recovery-diagnostics-privacy",
      "status": "passed",
      "evidence_url": "https://github.com/haya-inc/hayasend/issues/103"
    },
    {
      "case_id": "payload-orphan",
      "status": "passed",
      "evidence_url": "https://github.com/haya-inc/hayasend/issues/103"
    },
    {
      "case_id": "webhook-duplicate",
      "status": "passed",
      "evidence_url": "https://github.com/haya-inc/hayasend/issues/103"
    },
    {
      "case_id": "deploy-interruption",
      "status": "passed",
      "evidence_url": "https://github.com/haya-inc/hayasend/issues/104"
    },
    {
      "case_id": "backup-restore",
      "status": "passed",
      "evidence_url": "https://github.com/haya-inc/hayasend/actions/runs/30350436333"
    },
    {
      "case_id": "telemetry-private-fields",
      "status": "passed",
      "evidence_url": "https://github.com/haya-inc/hayasend/issues/103"
    },
    {
      "case_id": "provider-send-idempotency",
      "status": "unsupported",
      "evidence_url": "https://github.com/haya-inc/hayasend/issues/103",
      "reason": "Cloudflare does not document a durable provider-side send idempotency key.",
      "capability_path": "features.provider_idempotency.status"
    },
    {
      "case_id": "provider-open-events",
      "status": "unsupported",
      "evidence_url": "https://github.com/haya-inc/hayasend/issues/103",
      "reason": "Cloudflare Email Sending subscriptions do not publish open events.",
      "capability_path": "events.opened.status"
    },
    {
      "case_id": "provider-click-events",
      "status": "unsupported",
      "evidence_url": "https://github.com/haya-inc/hayasend/issues/103",
      "reason": "Cloudflare Email Sending subscriptions do not publish click events.",
      "capability_path": "events.clicked.status"
    }
  ]
}
